Base DRG,Included MS-DRG Codes,Descriptor
295,928; 929,Full Thickness Burn with Skin Graft or Inhalation Injury with CC/MCC; Full Thickness Burn with Skin Graft or Inhalation Injury without CC/MCC
296,935,Nontraumatic Stupor and Coma with MCC
297,939; 940; 941,O.R. Procedures for Obesity with MCC; O.R. Procedures for Obesity with CC; O.R. Procedures for Obesity without CC/MCC
298,945; 946,Rehabilitation with MCC; Rehabilitation without MCC
299,947; 948,Signs and Symptoms with MCC; Signs and Symptoms without MCC
300,949; 950,Adrenal and Pituitary Procedures with CC/MCC; Adrenal and Pituitary Procedures without CC/MCC
301,951,Other Endocrine Disorders with MCC
302,956,"Limb Reattachment Procedures, Hip and Femur with MCC"
303,957; 958; 959,Other O.R. Procedures with MCC; Other O.R. Procedures with CC; Other O.R. Procedures without CC/MCC
304,963; 964; 965,Other Multiple Significant Trauma with MCC; Other Multiple Significant Trauma with CC; Other Multiple Significant Trauma without CC/MCC
305,969; 970,HIV with Major Related Condition with MCC; HIV with Major Related Condition without MCC
306,974; 975; 976,Hiv with Extensive O.R. Procedure with MCC; Hiv with Extensive O.R. Procedure without MCC; Hiv with Major Related Condition with CC
307,977,Hiv with Major Related Condition without CC/MCC
308,981; 982; 983,Extensive O.R. Procedure Unrelated to Principal Diagnosis with MCC; Extensive O.R. Procedure Unrelated to Principal Diagnosis with CC; Extensive O.R. Procedure Unrelated to Principal Diagnosis without CC/MCC
309,984; 985; 986,Non-Extensive O.R. Procedure Unrelated to Principal Diagnosis with MCC; Non-Extensive O.R. Procedure Unrelated to Principal Diagnosis with CC; Non-Extensive O.R. Procedure Unrelated to Principal Diagnosis without CC/MCC
310,987; 988; 989,Non-Extensive O.R. Procedure Unrelated to Principal Diagnosis with MCC; Non-Extensive O.R. Procedure Unrelated to Principal Diagnosis with CC; Non-Extensive O.R. Procedure Unrelated to Principal Diagnosis without CC/MCC
311,999,Unclassified Major Diagnostic Categories